{
  "schema_version": "control-plane/composition-request/v1",
  "request_id": "demo_shop/requests/1",
  "project_ref": "demo_shop",
  "configuration_ref": {
    "configuration_id": "demo_shop/configurations/1",
    "digest": "sha256:51dcc09098ee12cc26e67ded3aa7ed069da5dab068adf4349ddaf09d3e5ef262"
  },
  "approval_ref": {
    "approval_id": "demo_shop/approvals/1",
    "digest": "sha256:db9449029487d6e5d868218468e5659558841a81cff53f1191d2959b4f201398"
  },
  "generator_version": "control-plane/composition-requests/v1",
  "request": {
    "$schema": "factory/composer/schema/composition_request.schema.json",
    "manifest": {
      "manifest_id": "demo_shop_platform",
      "manifest_version": "1.0.0"
    },
    "components": [
      {
        "component_id": "identity",
        "component_version": "0.3.1"
      },
      {
        "component_id": "tenant_authority",
        "component_version": "0.1.0"
      }
    ],
    "configuration": {
      "identity": {
        "current_platform_id": "demo_shop_platform"
      },
      "tenant_authority": {
        "platform_id": "demo_shop_platform"
      }
    }
  },
  "digest": "sha256:9830e2769720eefb63e71c01f825bc8ce53fd21ea35b20f7a245514dd44fd828"
}
